{
  "schema_version": 1,
  "receipt_id": "HDR-fromdemotospec-adapter-demo",
  "request_id": "ARQ-fromdemotospec-adapter-demo",
  "project_ref": "fromdemotospec:Demo/deepdive",
  "decision_packet_ref": "decision:DCP-fromdemotospec-adapter-demo",
  "action": "accepted",
  "producer_ref": "producer:user",
  "producer_confirmed": true,
  "host_record_ref": "fromdemotospec:Demo/deepdive/CHANGELOG.md#analysis-decision",
  "host_record_confirmed": true,
  "recorded_at": "2026-08-27T18:30:00+08:00"
}
